"Title","Year","DOI","score","title_dist","new_title","Project","Relation"
"The spatial scale mismatch between ecological processes and agricultural management: Do difficulties come from underlying theoretical frameworks?",2010,"10.1016/j.agee.2010.09.004","79.451546",0,"The spatial scale mismatch between ecological processes and agricultural management: Do difficulties come from underlying theoretical frameworks?","Motiver","Proposal"
"The geography of megatrends affecting European agriculture",2022,"10.1016/j.gloenvcha.2022.102551","31.770515",0,"The geography of megatrends affecting European agriculture","Motiver","Proposal"
"Sustainable landscape, soil and crop management practices enhance biodiversity and yield in conventional cereal systems",2021,"10.1111/1365-2664.13821","63.41677",0,"Sustainable landscape, soil and crop management practices enhance biodiversity and yield in conventional cereal systems","Motiver","Proposal"
"Microclima: An r package for modelling meso‐and microclimate",2019,"10.1111/2041-210x.13093","37.831573",8,"Microclima: An <scp>r</scp> package for modelling meso‐ and microclimate","Motiver","Proposal"
"Meta-analysis of climate impacts and uncertainty on crop yields in Europe",2016,"10.1088/1748-9326/11/11/113004","43.76557",0,"Meta-analysis of climate impacts and uncertainty on crop yields in Europe","Motiver","Proposal"
"Mapping and modelling past and future land use change in Europe’s cultural landscapes",2019,"10.1016/j.landusepol.2018.04.030","53.66483",0,"Mapping and modelling past and future land use change in Europe’s cultural landscapes","Motiver","Proposal"
"Landscape drivers of mammal habitat use and richness in a protected area and its surrounding agricultural lands",2022,"10.1016/j.agee.2022.107989","70.947716",0,"Landscape drivers of mammal habitat use and richness in a protected area and its surrounding agricultural lands","Motiver","Proposal"
"L’approche écopaysagère, mise en évidence des trames vertes dans les territoires ruraux",2017,NA,NA,NA,NA,"Motiver","Proposal"
"Global assessment report on biodiversity and ecosystem services of the Intergovernmental Science-Policy Platform on Biodiversity and Ecosystem Services",2019,"10.5281/zenodo.3831673",NA,NA,NA,"Motiver","Proposal"
"Functional traits of carabid beetles reveal seasonal variation in community assembly in annual crops",2022,"10.1101/2021.02.04.429696",NA,0,"Functional traits of carabid beetles reveal seasonal variation in community assembly in annual crops","Motiver","Proposal"
"From farm to fork: Our food, our health, our planet, our future",2020,NA,NA,NA,NA,"Motiver","Proposal"
"Farmland abandonment in Europe: Identification of drivers and indicators, and development of a composite indicator of risk",2015,"10.1016/j.landusepol.2015.06.009","53.13582",0,"Farmland abandonment in Europe: Identification of drivers and indicators, and development of a composite indicator of risk","Motiver","Proposal"
"Évaluation de la biodiversité des paysages bocagers et validation d’outils de diagnostic",2020,NA,NA,NA,NA,"Motiver","Proposal"
"Écoantibio 2 : plan national de réduction des risques d’antibiorésistance en médecine vétérinaire (2017 - 2022)",2021,NA,NA,NA,NA,"Motiver","Proposal"
"Contrasting responses of above- and belowground diversity to multiple components of land-use intensity",2021,"10.1038/s41467-021-23931-1","29.653286",0,"Contrasting responses of above- and belowground diversity to multiple components of land-use intensity","Motiver","Proposal"
"Constraints and opportunities for mainstreaming biodiversity and ecosystem services in the EU’s Common Agricultural Policy: Insights from the IPBES assessment for Europe and Central Asia",2019,"10.1016/j.landusepol.2019.104099","74.31131",0,"Constraints and opportunities for mainstreaming biodiversity and ecosystem services in the EU’s Common Agricultural Policy: Insights from the IPBES assessment for Europe and Central Asia","Motiver","Proposal"
"Biodiversity conservation in agriculture requires a multi-scale approach",2014,"10.1098/rspb.2014.1358","34.5636",0,"Biodiversity conservation in agriculture requires a multi-scale approach","Motiver","Proposal"
"Beyond organic farming–harnessing biodiversity-friendly landscapes",2021,"10.1016/j.tree.2021.06.010","43.856525",0,"Beyond organic farming – harnessing biodiversity-friendly landscapes","Motiver","Proposal"
"Arthropod decline in grasslands and forests is associated with landscape-level drivers",2019,"10.1038/s41586-019-1684-3","42.582916",0,"Arthropod decline in grasslands and forests is associated with landscape-level drivers","Motiver","Proposal"
"Agriculture and climate change are reshaping insect biodiversity worldwide",2022,"10.1038/s41586-022-04644-x","50.51635",0,"Agriculture and climate change are reshaping insect biodiversity worldwide","Motiver","Proposal"
"A review of the interactions between biodiversity, agriculture, climate change, and international trade: Research and policy priorities",2021,"10.1016/j.oneear.2020.12.008","47.904366",0,"A review of the interactions between biodiversity, agriculture, climate change, and international trade: research and policy priorities","Motiver","Proposal"
"A global synthesis of the effects of diversified farming systems on arthropod diversity within fields and across agricultural landscapes",2017,"10.1111/gcb.13714","29.124002",0,"A global synthesis of the effects of diversified farming systems on arthropod diversity within fields and across agricultural landscapes","Motiver","Proposal"
"‘Neo-productivist’agriculture: Spatio-temporal versus structuralist perspectives",2015,"10.1016/j.jrurstud.2015.02.003","61.732628",0,"‘Neo-productivist’ agriculture: Spatio-temporal versus structuralist perspectives","Motiver","Proposal"
"Urban earthworm communities driven more by climate and elevation than urbanisation intensity",2025,"10.1007/s11252-025-01826-z",NA,NA,NA,"Landworm","Output"
"Reliability of earthworm data from citizen science: Lessons from 7 years of a French national monitoring protocol",2025,"10.1016/j.apsoil.2025.106329",NA,NA,NA,"Landworm","Output"
"Putting earthworm conservation on the map: Shortfalls and solutions for developing earthworm conservation",2025,"10.1016/j.biocon.2024.110911",NA,NA,NA,"Landworm","Output"
"Management of grassland: A necessary tool to maintain plant and earthworm diversity",2024,"10.1016/j.ejsobi.2023.103589",NA,NA,NA,"Landworm","Output"
"Use of X-ray microcomputed tomography for characterizing earthworm-derived belowground soil aggregates",2020,"10.1111/ejss.12950","65.76162",0,"Use of X‐ray microcomputed tomography for characterizing earthworm‐derived belowground soil aggregates","Landworm","Top5"
"Urban and industrial land uses have a higher soil biological quality than expected from physicochemical quality",2017,"10.1016/j.scitotenv.2017.01.086","71.28256",0,"Urban and industrial land uses have a higher soil biological quality than expected from physicochemical quality","Landworm","Top5"
"Tracking, targeting, and conserving soil biodiversity",2021,"10.1126/science.abd7926","20.75605",0,"Tracking, targeting, and conserving soil biodiversity","Landworm","Top5"
"Towards an integrative understanding of soil biodiversity",2020,"10.1111/brv.12567",NA,0,"Towards an integrative understanding of soil biodiversity.","Landworm","Top5"
"Toward an integrative understanding of soil biodiversity",2020,NA,NA,NA,NA,"Landworm","Top5"
"The contributions of enchytraeids and earthworms to the soil mineralization process in soils with fungicide",2021,"10.1007/s10646-021-02452-z",NA,NA,NA,"Landworm","Top5"
"Soil fauna and structural responses to the settlement of a semi-sedentary earthworm Lumbricus terrestris in an arable clay field",2017,"10.1016/j.soilbio.2017.09.001","89.05465",1,"Soil faunal and structural responses to the settlement of a semi-sedentary earthworm Lumbricus terrestris in an arable clay field","Landworm","Top5"
"Selecting cost effective and policy-relevant biological indicators for European monitoring of soil biodiversity and ecosystem function",2016,"10.1016/j.ecolind.2016.04.023","47.959553",0,"Selecting cost effective and policy-relevant biological indicators for European monitoring of soil biodiversity and ecosystem function","Landworm","Top5"
"Rock-Eval pyrolysis discriminates soil macro-aggregates formed by plants and earthworms",2021,NA,NA,NA,NA,"Landworm","Top5"
"Response of earthworm communities to soil engineering and soil isolation in urban landscapes",2021,"10.1016/j.ecoleng.2021.106307","54.73954",0,"Response of earthworm communities to soil engineering and soil isolation in urban landscapes","Landworm","Top5"
"Residues of currently used pesticides in soils and earthworms: a silent threat?",2021,"10.1016/j.agee.2020.107167","53.32863",0,"Residues of currently used pesticides in soils and earthworms: A silent threat?","Landworm","Top5"
"Relative importance of tree species richness, tree functional type, and microenvironment for soil macrofauna communities in European forests",2021,"10.1007/s00442-021-04931-w","67.43445",0,"Relative importance of tree species richness, tree functional type, and microenvironment for soil macrofauna communities in European forests","Landworm","Top5"
"Relative importance of tree diversity, identity, and microenvironment in shaping soil macroinvertebrates community in European forests",2021,NA,NA,NA,NA,"Landworm","Top5"
"Positive feedback loop between earthworms, humus form and soil pH reinforces earthworm abundance in European forests",2020,"10.1111/1365-2435.13668","82.8805",0,"Positive feedback loop between earthworms, humus form and soil pH reinforces earthworm abundance in European forests","Landworm","Top5"
"Plant identity control on soil food web structure and C transfers under perennial bioenergy plantations",2019,"10.1016/j.soilbio.2019.107603","74.66262",0,"Plant identity control on soil food web structure and C transfers under perennial bioenergy plantations","Landworm","Top5"
"Pioneer plant Phalaris arundinacea and earthworms promote initial soil structure formation despite strong alluvial dynamics in a semi-controlled field experiment",2019,"10.1016/j.catena.2019.04.001","107.143906",0,"Pioneer plant Phalaris arundinacea and earthworms promote initial soil structure formation despite strong alluvial dynamics in a semi-controlled field experiment","Landworm","Top5"
"More frequent droughts slow down litter decomposition across European agroecosystems and increase the importance of earthworm functional diversity",2020,"10.1016/j.apsoil.2020.103628","62.533947",0,"More frequent droughts slow down litter decomposition across European agroecosystems and increase the importance of earthworm functional diversity","Landworm","Top5"
"Modeling of Soil Functions for Assessing Soil Quality: Soil Biodiversity and Habitat Provisioning",2019,"10.3389/fenvs.2019.00113","57.31446",0,"Modeling of Soil Functions for Assessing Soil Quality: Soil Biodiversity and Habitat Provisioning","Landworm","Top5"
"Methods and approaches to advance soil macroecology",2020,"10.1111/geb.13156","18.710041",0,"Methods and approaches to advance soil macroecology","Landworm","Top5"
"Mapping earthworm communities in Europe",2016,"10.1163/22117954-12341345","22.475594",9,"Mapping Shia Muslim Communities in Europe","Landworm","Top5"
"LUCAS Soil, the largest expandable soil dataset for Europe: a review",2018,"10.1111/ejss.12499","48.139908",0,"LUCAS Soil, the largest expandable soil dataset for Europe: a review","Landworm","Top5"
"Litter decomposition driven by soil fauna, plant diversity and soil management in urban gardens",2019,"10.1016/j.scitotenv.2018.12.235","60.749",0,"Litter decomposition driven by soil fauna, plant diversity and soil management in urban gardens","Landworm","Top5"
"Legacy effects of temporary grassland in annual crop rotation on soil ecosystem services",2021,"10.1016/j.scitotenv.2021.146140","32.522358",0,"Legacy effects of temporary grassland in annual crop rotation on soil ecosystem services","Landworm","Top5"
"Land-use effects on local biodiversity in tropical forests vary between continents",2017,"10.1007/s10531-017-1356-2","59.696495",0,"Land-use effects on local biodiversity in tropical forests vary between continents","Landworm","Top5"
"Intraspecific body size variability in soil organisms at a European scale: implications for functional biogeography",2018,"10.1111/1365-2435.13194","62.110252",0,"Intraspecific body size variability in soil organisms at a European scale: Implications for functional biogeography","Landworm","Top5"
"Handbook of protocols for standardized measurement of terrestrial invertebrate functional traits",2017,"10.1111/1365-2435.12776","33.964775",0,"Handbook of protocols for standardized measurement of terrestrial invertebrate functional traits","Landworm","Top5"
"Global data on earthworm abundance, biomass, diversity and corresponding environmental properties",2021,"10.1038/s41597-021-00912-z",NA,0,"Global data on earthworm abundance, biomass, diversity and corresponding environmental properties.","Landworm","Top5"
"Forest conversion to conifers induces a regime shift in soil process domain affecting carbon stability",2019,"10.1016/j.soilbio.2019.107540","77.2651",0,"Forest conversion to conifers induces a regime shift in soil process domain affecting carbon stability","Landworm","Top5"
"Enchytraeids as bioindicators of land use and management. In Humusica, a manual of humus forms",2018,NA,NA,NA,NA,"Landworm","Top5"
"Effects of temporary grassland introduction into annual crop rotations and nitrogen fertilisation on earthworm communities and forage production",2021,"10.1016/j.apsoil.2021.103893","83.41096",0,"Effects of temporary grassland introduction into annual crop rotations and nitrogen fertilisation on earthworm communities and forage production","Landworm","Top5"
"Effects of silver nanoparticle on survival, biomass change and avoidance behaviour of the endogeic earthworm Allolobophora chlorotica",2017,"10.1016/j.ecoenv.2017.03.015","90.60924",1,"Effects of silver nanoparticles on survival, biomass change and avoidance behaviour of the endogeic earthworm Allolobophora chlorotica","Landworm","Top5"
"Earthworm dispersal of plant litter across the surface of agricultural soils",2019,"10.1002/ecy.2669","56.654823",0,"Earthworm dispersal of plant litter across the surface of agricultural soils","Landworm","Top5"
"Earthworm community development in soils of a reclaimed steelworks",2021,"10.1016/s1002-0160(20)60087-x","55.345673",0,"Earthworm community development in soils of a reclaimed steelworks","Landworm","Top5"
"Contrasting effects of cover crops on earthworms: Results from field monitoring and laboratory experiments on growth, reproduction and food choice",2020,"10.1016/j.ejsobi.2020.103225","73.16055",0,"Contrasting effects of cover crops on earthworms: Results from field monitoring and laboratory experiments on growth, reproduction and food choice","Landworm","Top5"
"Cascading effects of moth outbreaks on subarctic soil food webs",2021,"10.1038/s41598-021-94227-z","51.10987",0,"Cascading effects of moth outbreaks on subarctic soil food webs","Landworm","Top5"
"Aporrectodea caliginosa s.s, a relevant earthworm species for a posteriori pesticide risk assessment: Current knowledge and recommendations for culture and experimental design",2018,"10.1007/s11356-018-2579-9","85.46424",4,"Aporrectodea caliginosa, a relevant earthworm species for a posteriori pesticide risk assessment: current knowledge and recommendations for culture and experimental design","Landworm","Top5"
"Analysis of complex trophic networks reveals the signature of land-use intensification on soil communities in agroecosystems",2021,"10.1038/s41598-021-97300-9",NA,0,"Analysis of complex trophic networks reveals the signature of land-use intensification on soil communities in agroecosystems.","Landworm","Top5"
"Above‐and belowground complementarity rather than selection drives tree diversity‐productivity relationships in European forests",2021,"10.1111/1365-2435.13825",NA,NA,NA,"Landworm","Top5"
"A two years field experiment to assess the impact of two fungicides on earthworm communities and their recovery.",2020,"10.1016/j.ecoenv.2020.110979","49.031067",0,"A two years field experiment to assess the impact of two fungicides on earthworm communities and their recovery","Landworm","Top5"
"A knowledge-based approach to estimating the magnitude and spatial patterns of potential threats to soil biodiversity",2016,"10.1016/j.scitotenv.2015.12.092","57.29692",0,"A knowledge-based approach to estimating the magnitude and spatial patterns of potential threats to soil biodiversity","Landworm","Top5"
"A “Dirty” Footprint: Macroinvertebrate diversity in Amazonian anthropogenic soils",2021,NA,NA,NA,NA,"Landworm","Top5"
"The Temporal Dynamics of Multiple Stressor Effects: From Individuals to Ecosystems",2021,"10.1016/j.tree.2021.01.005",NA,NA,NA,"Landworm","Proposal"
"The return of the variance: intraspecific variability in community ecology",2012,"10.1016/j.tree.2011.11.014",NA,NA,NA,"Landworm","Proposal"
"The efficiency of earthworm extraction methods is determined by species and soil properties in the Mediterranean communities of Central-Western Spain",2016,"10.1016/j.ejsobi.2016.01.005","69.21581",0,"The efficiency of earthworm extraction methods is determined by species and soil properties in the Mediterranean communities of Central-Western Spain","Landworm","Proposal"
"The effects of organic agriculture on biodiversity and abundance: a meta-analysis",2005,"10.1111/j.1365-2664.2005.01005.x",NA,NA,NA,"Landworm","Proposal"
"The Accuracy of Citizen Science Data: A Quantitative Review",2017,"10.1002/bes2.1336","26.406181",0,"The Accuracy of Citizen Science Data: A Quantitative Review","Landworm","Proposal"
"Statistical solutions for error and bias in global citizen science datasets",2014,"10.1016/j.biocon.2013.07.037",NA,NA,NA,"Landworm","Proposal"
"State of knowledge of soil biodiversity - Status, challenges and potentialities",2020,"10.4060/cb1928en",NA,NA,NA,"Landworm","Proposal"
"Selecting cost effective and policy-relevant biological indicators for European monitoring of soil biodiversity and ecosystem function",2016,"10.1016/j.ecolind.2016.04.023",NA,NA,NA,"Landworm","Proposal"
"Priorities for research in soil ecology",2017,"10.1016/j.pedobi.2017.05.003",NA,0,"Priorities for research in soil ecology.","Landworm","Proposal"
"Predicting soil micro-variables and the distribution of an endogeic earthworm species through a model based on large-scale variables ",2015,"10.1016/j.soilbio.2014.10.023",NA,NA,NA,"Landworm","Proposal"
"Predation on earthworms by terrestrial vertebrates",1983,"10.1007/978-94-009-5965-1_35","46.440594",0,"Predation on earthworms by terrestrial vertebrates","Landworm","Proposal"
"Plant functional traits capture species richness variations along a flooding gradient",2011,"10.1111/j.1600-0706.2010.18525.x",NA,NA,NA,"Landworm","Proposal"
"Phylogenetic grouping, curvature and metabolic scaling in terrestrial invertebrates",2011,"10.1111/j.1461-0248.2011.01660.x",NA,NA,NA,"Landworm","Proposal"
"Pesticides and earthworms. A review",2014,"10.1007/s13593-013-0151-z",NA,NA,NA,"Landworm","Proposal"
"Multiple elements of soil biodiversity drive ecosystem functions across biomes",2020,"10.1038/s41559-019-1084-y",NA,0,"Multiple elements of soil biodiversity drive ecosystem functions across biomes.","Landworm","Proposal"
"More frequent droughts slow down litter decomposition across European agroecosystems and increase the importance of earthworm functional diversity",2020,"10.1016/j.apsoil.2020.103628",NA,NA,NA,"Landworm","Proposal"
"Mapping and predictive variations of soil bacterial richness across France",2017,"10.1371/journal.pone.0186766",NA,NA,NA,"Landworm","Proposal"
"Intraspecific trait variation in plants: a renewed focus on its role in ecological processes",2021,"10.1093/aob/mcab011",NA,NA,NA,"Landworm","Proposal"
"Intraspecific body size variability in soil organisms at a European scale: Implications for functional biogeography",2018,"10.1111/1365-2435.13194",NA,NA,NA,"Landworm","Proposal"
"Integration of biodiversity in soil quality monitoring: Baselines for microbial and soil fauna parameters for different land-use types",2012,"10.1016/j.ejsobi.2011.11.003","72.28323",0,"Integration of biodiversity in soil quality monitoring: Baselines for microbial and soil fauna parameters for different land-use types","Landworm","Proposal"
"Indicators for monitoring soil biodiversity",2009,"10.1897/IEAM-2009-064.1",NA,NA,NA,"Landworm","Proposal"
"Improving occurrence-based rarity metrics in conservation studies by including multiple rarity cut-off points",2012,"10.1111/j.1752-4598.2011.00148.x",NA,NA,NA,"Landworm","Proposal"
"Global soil biodiversity atlas",2016,"10.5860/choice.52-0264","22.380894",9,"Global Freshwater Biodiversity Atlas","Landworm","Proposal"
"Global distribution of earthworm diversity",2019,"10.1126/science.aax4851",NA,NA,NA,"Landworm","Proposal"
"Glaciation as an historical filter of below-ground biodiversity",2014,"10.1111/jbi.12284","42.246307",0,"Glaciation as an historical filter of below‐ground biodiversity","Landworm","Proposal"
"Generalist plants are more competitive and more functionally similar to each other than specialist plants: insights from network analyses",2020,"10.1111/jbi.13848",NA,NA,NA,"Landworm","Proposal"
"Functional Rarity: The Ecology of Outliers",2017,"10.1016/j.tree.2017.02.002",NA,NA,NA,"Landworm","Proposal"
"Extraction of earthworm from soil by different sampling methods: a review",2016,"10.1007/s10668-015-9703-5",NA,NA,NA,"Landworm","Proposal"
"Environmental controls on the causes and functional consequences of tree species diversity",2018,"10.1111/1365-2745.12851","46.46686",0,"Environmental controls on the causes and functional consequences of tree species diversity","Landworm","Proposal"
"EGrowth: A global database on intraspecific body growth variability in earthworm",2018,"10.1016/j.soilbio.2018.04.004","69.11258",0,"EGrowth: A global database on intraspecific body growth variability in earthworm","Landworm","Proposal"
"Effects of temporary grassland introduction into annual crop rotations and nitrogen fertilisation on earthworm communities and forage production",2021,"10.1016/j.apsoil.2021.103893",NA,NA,NA,"Landworm","Proposal"
"Earthworm indicators as tools for soil monitoring, characterization and risk assessment. An example from the national Bioindicator programme (France)",2011,"10.1016/j.pedobi.2011.09.015",NA,NA,NA,"Landworm","Proposal"
"Dynamics of earthworm taxonomic and functional diversity in ploughed and no-tilled cropping systems",2016,"10.1016/j.still.2015.07.016","62.79616",0,"Dynamics of earthworm taxonomic and functional diversity in ploughed and no-tilled cropping systems","Landworm","Proposal"
"Data Validation Infrastructure for R",2021,"10.18637/jss.v097.i10",NA,NA,NA,"Landworm","Proposal"
"Cross-validation strategies for data with temporal, spatial, hierarchical, or phylogenetic structure",2017,"10.1111/ecog.02881",NA,NA,NA,"Landworm","Proposal"
"Conventional tillage decreases the abundance and biomass of earthworms and alters their community structure in a global meta-analysis",2017,"10.1111/gcb.13744","76.91383",0,"Conventional tillage decreases the abundance and biomass of earthworms and alters their community structure in a global meta‐analysis","Landworm","Proposal"
"Consistency of species ranking based on functional leaf traits",2001,"10.1046/j.0028-646x.2001.00239.x",NA,NA,NA,"Landworm","Proposal"
"Comparison of two widely used sampling methods in assessing earthworm community responses to agricultural intensification",2017,"10.1016/j.apsoil.2017.06.011","75.2575",0,"Comparison of two widely used sampling methods in assessing earthworm community responses to agricultural intensification","Landworm","Proposal"
"Climate change effects on earthworms - a review",2019,"10.25674/so91iss3pp114",NA,NA,NA,"Landworm","Proposal"
"Citizen science involving farmers as a means to document temporal trends in farmland biodiversity and relate them to agricultural practices",2021,"10.1111/1365-2664.13746",NA,NA,NA,"Landworm","Proposal"
"cati: an R package using functional traits to detect and quantify multi-level community assembly processes",2016,"10.1111/ecog.01433",NA,NA,NA,"Landworm","Proposal"
"Blind spots in global soil biodiversity and ecosystem function research",2020,"10.1038/s41467-020-17688-2",NA,NA,NA,"Landworm","Proposal"
"Biogeography of soil bacteria and archaea across France",2018,"10.1126/sciadv.aat1808",NA,NA,NA,"Landworm","Proposal"
"Biodiversity in cities needs space: a meta-analysis of factors determining intra-urban biodiversity variation",2015,"10.1111/ele.12427",NA,NA,NA,"Landworm","Proposal"
"Belowground biodiversity and ecosystem functioning",2014,"10.1038/nature13855",NA,NA,NA,"Landworm","Proposal"
"Assessing data quality in citizen science",2016,"10.1002/fee.1436",NA,NA,NA,"Landworm","Proposal"
"Assembly rules within earthworm communities in North-Western France - A regional analysis",2008,"10.1016/j.apsoil.2008.01.007","62.181576",0,"Assembly rules within earthworm communities in North-Western France—A regional analysis","Landworm","Proposal"
"Are trait-based species rankings consistent across data sets and spatial scales?",2014,"10.1111/jvs.12066",NA,NA,NA,"Landworm","Proposal"
"Analyse critique des connaissances sur les prédateurs de lombriciens",1988,NA,NA,NA,NA,"Landworm","Proposal"
"An index for assessing the rare species of a community",2021,"10.1016/j.ecolind.2021.107424",NA,NA,NA,"Landworm","Proposal"
